<p>,name,name_first,</p>,<p>,distance,distance,</p>,<p>,Duration : ,completionTime,</p>,<p>,Overnight : ,duration_nights, nights,</p>,<p>,Difficulty : ,difficulty,</p>,<p>,Course style : ,course_style,</p>,<p>,Coordinates,X,latitude,Y,</p>,<br>,<h3>,*** Trekourse Review ***,</h3>,<p>,introduction
<p>,1. Course name : ,Kaituna Valley Packhorse Hut Track,</p>,<p>,2. Distance : ,3.72 kilometer,</p>,<p>,3. Duration : ,1 hr 20 min,</p>,<p>,4. Overnight : ,0, nights,</p>,<p>,5. Difficulty : ,Intermediate,</p>,<p>,6. Course style : ,one_way,</p>,<p>,7. Coordinates : longitude ,172.6945, and latitude ,-43.7163,</p>,<br>,<h3>,*** Trekourse Review ***,</h3>,<p>,The walk to Packhorse Hut can be enjoyed as a half day walk but is also a great overnight tramp for families with children and new trampers.
<p>,1. Course name : ,Dawson Falls Stratford Plateau tracks,</p>,<p>,2. Distance : ,8.73 kilometer,</p>,<p>,3. Duration : ,1 hr 20 min one way | 3 hr 30 min - 4 hr return,</p>,<p>,4. Overnight : ,0, nights,</p>,<p>,5. Difficulty : ,Advanced,</p>,<p>,6. Course style : ,both,</p>,<p>,7. Coordinates : longitude ,174.1078, and latitude ,-39.3168,</p>,<br>,<h3>,*** Trekourse Review ***,</h3>,<p>,Walk one way from Dawson Falls to Stratford Plateau or complete a circuit back to Dawson Falls.
<p>,1. Course name : ,Makahu Road tramping tracks,</p>,<p>,2. Distance : ,23.6 kilometer,</p>,<p>,3. Duration : ,8 hr | 11 hr one way,</p>,<p>,4. Overnight : ,0, nights,</p>,<p>,5. Difficulty : ,Advanced,</p>,<p>,6. Course style : ,one_way,</p>,<p>,7. Coordinates : longitude ,176.4266, and latitude ,-39.2272,</p>,<br>,<h3>,*** Trekourse Review ***,</h3>,<p>,The narrow Makahu Road provides access to the Makino and Middle Hill huts.
<p>,1. Course name : ,Upper Copland Valley Track,</p>,<p>,2. Distance : ,29.94 kilometer,</p>,<p>,3. Duration : ,3 days +,</p>,<p>,4. Overnight : ,3, nights,</p>,<p>,5. Difficulty : ,"Advanced,Expert",</p>,<p>,6. Course style : ,one_way,</p>,<p>,7. Coordinates : longitude ,169.9395, and latitude ,-43.6238,</p>,<br>,<h3>,*** Trekourse Review ***,</h3>,<p>,The Upper Copland Valley Track provides access to Douglas Rock Hut. It is suitable for well-equipped and experienced backcountry trampers and mountaineers only.
<p>,1. Course name : ,Purakaunui Falls Walk,</p>,<p>,2. Distance : ,516.55 meter,</p>,<p>,3. Duration : ,20 min,</p>,<p>,4. Overnight : ,0, nights,</p>,<p>,5. Difficulty : ,Easiest,</p>,<p>,6. Course style : ,one_way,</p>,<p>,7. Coordinates : longitude ,169.5614, and latitude ,-46.5177,</p>,<br>,<h3>,*** Trekourse Review ***,</h3>,<p>,Walk to the well known and often photographed Purakaunui Falls.
<p>,1. Course name : ,Lake Waikareiti Walk,</p>,<p>,2. Distance : ,3.21 kilometer,</p>,<p>,3. Duration : ,2 hr,</p>,<p>,4. Overnight : ,0, nights,</p>,<p>,5. Difficulty : ,Easy,</p>,<p>,6. Course style : ,one_way,</p>,<p>,7. Coordinates : longitude ,177.1639, and latitude ,-38.7338,</p>,<br>,<h3>,*** Trekourse Review ***,</h3>,<p>,The Lake Waikareiti Walk will take you two hours to complete a return trip. Along the way you may hear the screech of the kaka and the chatty ki-ki-ki of the yellow-crowned parakeet (kakariki). 
<p>,1. Course name : ,Moeraki Valley Track,</p>,<p>,2. Distance : ,14 kilometer,</p>,<p>,3. Duration : ,2+ days,</p>,<p>,4. Overnight : ,2, nights,</p>,<p>,5. Difficulty : ,"Advanced,Expert",</p>,<p>,6. Course style : ,one_way,</p>,<p>,7. Coordinates : longitude ,169.4003, and latitude ,-43.8062,</p>,<br>,<h3>,*** Trekourse Review ***,</h3>,<p>,The Moeraki Valley offers good tramping for the fit and experienced. The U-shaped valley is typical of those carved out by glaciers during repeated glacial periods.  
<p>,1. Course name : ,Mount Stokes Track,</p>,<p>,2. Distance : ,3.33 kilometer,</p>,<p>,3. Duration : ,Half day,</p>,<p>,4. Overnight : ,0, nights,</p>,<p>,5. Difficulty : ,Advanced,</p>,<p>,6. Course style : ,one_way,</p>,<p>,7. Coordinates : longitude ,174.1196, and latitude ,-41.0868,</p>,<br>,<h3>,*** Trekourse Review ***,</h3>,<p>,"This tramping track in Kenepuru Sound follows a ridge to the summit (1203 m), the highest point in the Sounds."
<p>,1. Course name : ,Maryburn Stream Track,</p>,<p>,2. Distance : ,6.76 kilometer,</p>,<p>,3. Duration : ,2 hr,</p>,<p>,4. Overnight : ,0, nights,</p>,<p>,5. Difficulty : ,Advanced,</p>,<p>,6. Course style : ,one_way,</p>,<p>,7. Coordinates : longitude ,170.3296, and latitude ,-44.2064,</p>,<br>,<h3>,*** Trekourse Review ***,</h3>,<p>,"This track gives access to Maryburn Stream, or carry on further to Simons Hill. "
<p>,1. Course name : ,Buskin Highcliff and Paradise Road tracks,</p>,<p>,2. Distance : ,3.22 kilometer,</p>,<p>,3. Duration : ,1 hr 30 min,</p>,<p>,4. Overnight : ,0, nights,</p>,<p>,5. Difficulty : ,Advanced,</p>,<p>,6. Course style : ,one_way,</p>,<p>,7. Coordinates : longitude ,170.608, and latitude ,-45.8941,</p>,<br>,<h3>,*** Trekourse Review ***,</h3>,<p>,Walk or mountain bike tracks from Highcliff Road. 
<p>,1. Course name : ,Waikakaho Cullen Creek Walkway,</p>,<p>,2. Distance : ,13.64 kilometer,</p>,<p>,3. Duration : ,5 hr,</p>,<p>,4. Overnight : ,0, nights,</p>,<p>,5. Difficulty : ,Advanced,</p>,<p>,6. Course style : ,one_way,</p>,<p>,7. Coordinates : longitude ,173.8644, and latitude ,-41.3496,</p>,<br>,<h3>,*** Trekourse Review ***,</h3>,<p>,"This walkway follows an old goldminer's trail across the range between the Wairau Valley and Linkwater. It can be walked or ridden in one day, but you will need to arrange transport between the road ends."
<p>,1. Course name : ,Waterworks Walk,</p>,<p>,2. Distance : ,970.71 meter,</p>,<p>,3. Duration : ,1 hr return,</p>,<p>,4. Overnight : ,0, nights,</p>,<p>,5. Difficulty : ,Easiest,</p>,<p>,6. Course style : ,return,</p>,<p>,7. Coordinates : longitude ,175.1371, and latitude ,-37.6627,</p>,<br>,<h3>,*** Trekourse Review ***,</h3>,<p>,"Pass through attractive native bush, alongside a stream, to an old dam - it's ideal for children. "
<p>,1. Course name : ,Black Hill Hut tracks,</p>,<p>,2. Distance : ,9.19 kilometer,</p>,<p>,3. Duration : ,2 days,</p>,<p>,4. Overnight : ,2, nights,</p>,<p>,5. Difficulty : ,Advanced,</p>,<p>,6. Course style : ,one_way,</p>,<p>,7. Coordinates : longitude ,172.0403, and latitude ,-43.192,</p>,<br>,<h3>,*** Trekourse Review ***,</h3>,<p>,Walk to Black Hill Hut on one of these tracks or combine them to make a circuit.
<p>,1. Course name : ,Opua Kauri Walk,</p>,<p>,2. Distance : ,386.16 meter,</p>,<p>,3. Duration : ,30 min return,</p>,<p>,4. Overnight : ,0, nights,</p>,<p>,5. Difficulty : ,Easy,</p>,<p>,6. Course style : ,return,</p>,<p>,7. Coordinates : longitude ,174.0718, and latitude ,-35.32,</p>,<br>,<h3>,*** Trekourse Review ***,</h3>,<p>,A pleasant walk through regenerating forest to a lookout with stunning views over a valley that is home to kauri trees. 
<p>,1. Course name : ,Pearl Harbour return via Circle Track,</p>,<p>,2. Distance : ,6.86 kilometer,</p>,<p>,3. Duration : ,3 - 3.5 hr return,</p>,<p>,4. Overnight : ,0, nights,</p>,<p>,5. Difficulty : ,Advanced,</p>,<p>,6. Course style : ,return,</p>,<p>,7. Coordinates : longitude ,167.5885, and latitude ,-45.5801,</p>,<br>,<h3>,*** Trekourse Review ***,</h3>,<p>,"This tramping track takes you on a pleasant, half-day walk through beech forest near Manapouri, to a hill viewpoint overlooking the lake."
<p>,1. Course name : ,Kaharoa Kōkako Track,</p>,<p>,2. Distance : ,1.14 kilometer,</p>,<p>,3. Duration : ,45 min one way,</p>,<p>,4. Overnight : ,0, nights,</p>,<p>,5. Difficulty : ,Advanced,</p>,<p>,6. Course style : ,one_way,</p>,<p>,7. Coordinates : longitude ,176.2987, and latitude ,-37.9491,</p>,<br>,<h3>,*** Trekourse Review ***,</h3>,<p>,"Walk through beautiful forest to Onaia Stream, a tranquil and secluded spot that's ideal for a picnic or to cool off in - with geocaches as well this short walk has plenty to keep kids interested."
<p>,1. Course name : ,Mangahao Makahika Track,</p>,<p>,2. Distance : ,12.8 kilometer,</p>,<p>,3. Duration : ,"6 - 7 hrs going south, 7- 8 hrs going north",</p>,<p>,4. Overnight : ,0, nights,</p>,<p>,5. Difficulty : ,Advanced,</p>,<p>,6. Course style : ,one_way,</p>,<p>,7. Coordinates : longitude ,175.4347, and latitude ,-40.625,</p>,<br>,<h3>,*** Trekourse Review ***,</h3>,<p>,"The Mangahao Makahika Track connects Burtton's Track, which lies between Palmerston North and Shannon, with the Arapaepae Lookout Trail near Levin."
<p>,1. Course name : ,Skyline Track,</p>,<p>,2. Distance : ,21.86 kilometer,</p>,<p>,3. Duration : ,10-11 hrs,</p>,<p>,4. Overnight : ,0, nights,</p>,<p>,5. Difficulty : ,Advanced,</p>,<p>,6. Course style : ,one_way,</p>,<p>,7. Coordinates : longitude ,169.0729, and latitude ,-44.7221,</p>,<br>,<h3>,*** Trekourse Review ***,</h3>,<p>,The Skyline Track is a challenging tramping track in the Wanaka area.
<p>,1. Course name : ,Braemar Road to Landslip Creek,</p>,<p>,2. Distance : ,15.84 kilometer,</p>,<p>,3. Duration : ,3 hr one way,</p>,<p>,4. Overnight : ,0, nights,</p>,<p>,5. Difficulty : ,Advanced,</p>,<p>,6. Course style : ,one_way,</p>,<p>,7. Coordinates : longitude ,170.2452, and latitude ,-43.927,</p>,<br>,<h3>,*** Trekourse Review ***,</h3>,<p>,A public access easement leads to Landslip Creek above Lake Pukaki. 
<p>,1. Course name : ,Whitcombe Pass Track,</p>,<p>,2. Distance : ,32.19 kilometer,</p>,<p>,3. Duration : ,3-4 days to Whitcombe Pass,</p>,<p>,4. Overnight : ,3, nights,</p>,<p>,5. Difficulty : ,Advanced,</p>,<p>,6. Course style : ,one_way,</p>,<p>,7. Coordinates : longitude ,171.0091, and latitude ,-43.1057,</p>,<br>,<h3>,*** Trekourse Review ***,</h3>,<p>,The Whitcombe Pass Track takes you through the very rugged bush clad valleys of the lower Hokitika and Whitcombe Rivers to the Main Divide.  This guide describes the route from the Hokitika road end to Whitcombe Pass only.  
<p>,1. Course name : ,Wills Valley Track,</p>,<p>,2. Distance : ,7.32 kilometer,</p>,<p>,3. Duration : ,5 - 6 hr,</p>,<p>,4. Overnight : ,0, nights,</p>,<p>,5. Difficulty : ,Advanced,</p>,<p>,6. Course style : ,one_way,</p>,<p>,7. Coordinates : longitude ,169.4195, and latitude ,-44.0362,</p>,<br>,<h3>,*** Trekourse Review ***,</h3>,<p>,"This track is for experienced trampers and starts at the Gates of Haast Bridge. Like most of the smaller valleys in this area, the Wills’ lower reaches are gorged, and then open out to flats further up."
<p>,1. Course name : ,Titri Creek Track,</p>,<p>,2. Distance : ,718.07 meter,</p>,<p>,3. Duration : ,10 min,</p>,<p>,4. Overnight : ,0, nights,</p>,<p>,5. Difficulty : ,Easiest,</p>,<p>,6. Course style : ,one_way,</p>,<p>,7. Coordinates : longitude ,170.1132, and latitude ,-46.0016,</p>,<br>,<h3>,*** Trekourse Review ***,</h3>,<p>,See hundreds of wading birds on this family-friendly short walk into the Titri wetands.
<p>,1. Course name : ,Te Arapiki o Tawhaki,</p>,<p>,2. Distance : ,2.48 kilometer,</p>,<p>,3. Duration : ,2 hr ,</p>,<p>,4. Overnight : ,0, nights,</p>,<p>,5. Difficulty : ,Easy,</p>,<p>,6. Course style : ,one_way,</p>,<p>,7. Coordinates : longitude ,175.6372, and latitude ,-40.7256,</p>,<br>,<h3>,*** Trekourse Review ***,</h3>,<p>,Experience stunning views and native bush on Te Arapiki o Tawhaki at Pukaha Mount Bruce.
<p>,1. Course name : ,Onekura Track,</p>,<p>,2. Distance : ,7.13 kilometer,</p>,<p>,3. Duration : ,1 hr one way,</p>,<p>,4. Overnight : ,0, nights,</p>,<p>,5. Difficulty : ,Advanced,</p>,<p>,6. Course style : ,one_way,</p>,<p>,7. Coordinates : longitude ,173.7258, and latitude ,-35.1948,</p>,<br>,<h3>,*** Trekourse Review ***,</h3>,<p>,Tramping track for experienced trampers with good route-finding abilities. The route descends to the Waipapa River.
<p>,1. Course name : ,Pancake Rocks and Blowholes Walk,</p>,<p>,2. Distance : ,975.85 meter,</p>,<p>,3. Duration : ,20 min,</p>,<p>,4. Overnight : ,0, nights,</p>,<p>,5. Difficulty : ,"Easiest,Easy",</p>,<p>,6. Course style : ,one_way,</p>,<p>,7. Coordinates : longitude ,171.3276, and latitude ,-42.1152,</p>,<br>,<h3>,*** Trekourse Review ***,</h3>,<p>,"Explore a limestone landscape of pancake-shaped rock formations, blowholes and surge pools on this short, paved walk that's great for children. "
<p>,1. Course name : ,Butterfields Wetland Walk,</p>,<p>,2. Distance : ,1.11 kilometer,</p>,<p>,3. Duration : ,45 mins,</p>,<p>,4. Overnight : ,0, nights,</p>,<p>,5. Difficulty : ,Easy,</p>,<p>,6. Course style : ,one_way,</p>,<p>,7. Coordinates : longitude ,169.2112, and latitude ,-44.6735,</p>,<br>,<h3>,*** Trekourse Review ***,</h3>,<p>,"Situated near the Hāwea River Swing Bridge this small loop track around the Butterfields Wildlife Management Area is suitable for biking, running and walking. "
<p>,1. Course name : ,Teal Bay to South Coast Track,</p>,<p>,2. Distance : ,15.14 kilometer,</p>,<p>,3. Duration : ,10 hr,</p>,<p>,4. Overnight : ,0, nights,</p>,<p>,5. Difficulty : ,Advanced,</p>,<p>,6. Course style : ,one_way,</p>,<p>,7. Coordinates : longitude ,167.3397, and latitude ,-46.1214,</p>,<br>,<h3>,*** Trekourse Review ***,</h3>,<p>,"This difficult tramping track heads from the southern shore of Lake Hauroko, over alpine tops on Hump Ridge and down to the coast at Te Waewae Bay."
<p>,1. Course name : ,Mirror Lakes Walk,</p>,<p>,2. Distance : ,183.43 meter,</p>,<p>,3. Duration : ,10 min,</p>,<p>,4. Overnight : ,0, nights,</p>,<p>,5. Difficulty : ,Easiest,</p>,<p>,6. Course style : ,one_way,</p>,<p>,7. Coordinates : longitude ,168.0103, and latitude ,-45.0299,</p>,<br>,<h3>,*** Trekourse Review ***,</h3>,<p>,"Stroll among small lakes with lovely reflections of the Earl Mountains on this easy, short walk off Milford Road - it's great for children."
<p>,1. Course name : ,Hokitika Gorge Walk,</p>,<p>,2. Distance : ,609.43 meter,</p>,<p>,3. Duration : ,15 min,</p>,<p>,4. Overnight : ,0, nights,</p>,<p>,5. Difficulty : ,Easiest,</p>,<p>,6. Course style : ,one_way,</p>,<p>,7. Coordinates : longitude ,171.018, and latitude ,-42.956,</p>,<br>,<h3>,*** Trekourse Review ***,</h3>,<p>,"Enjoy excellent views of the blue-green waters of the Hokitika River as it makes its way through the rock sided Hokitika Gorge - this short, easy walk is a great option for kids."
<p>,1. Course name : ,Hongi Hika Walk,</p>,<p>,2. Distance : ,1.1 kilometer,</p>,<p>,3. Duration : ,1 hr,</p>,<p>,4. Overnight : ,0, nights,</p>,<p>,5. Difficulty : ,Easy,</p>,<p>,6. Course style : ,one_way,</p>,<p>,7. Coordinates : longitude ,173.959, and latitude ,-35.2203,</p>,<br>,<h3>,*** Trekourse Review ***,</h3>,<p>,"This short, easy walk passes through regenerating native forest to Kororipo pā - it's a great option for children to explore the heritage of early Maori/European settlement."
<p>,1. Course name : ,Otanewainuku walking tracks,</p>,<p>,2. Distance : ,6.84 kilometer,</p>,<p>,3. Duration : ,Various times under 2 hr,</p>,<p>,4. Overnight : ,0, nights,</p>,<p>,5. Difficulty : ,Easy,</p>,<p>,6. Course style : ,one_way,</p>,<p>,7. Coordinates : longitude ,176.2083, and latitude ,-37.8897,</p>,<br>,<h3>,*** Trekourse Review ***,</h3>,<p>,Explore Otanewainuku Forest on these short walks - there's an easier option for families with children.
<p>,1. Course name : ,Western Okataina Walkway,</p>,<p>,2. Distance : ,19.53 kilometer,</p>,<p>,3. Duration : ,7 hr,</p>,<p>,4. Overnight : ,0, nights,</p>,<p>,5. Difficulty : ,Advanced,</p>,<p>,6. Course style : ,one_way,</p>,<p>,7. Coordinates : longitude ,176.3927, and latitude ,-38.1059,</p>,<br>,<h3>,*** Trekourse Review ***,</h3>,<p>,Western Okataina Walkway is open for both walking and mountain biking.
<p>,1. Course name : ,Nga Taonga Nature Walk,</p>,<p>,2. Distance : ,1.2 kilometer,</p>,<p>,3. Duration : ,45 min one way,</p>,<p>,4. Overnight : ,0, nights,</p>,<p>,5. Difficulty : ,Easy,</p>,<p>,6. Course style : ,one_way,</p>,<p>,7. Coordinates : longitude ,174.9241, and latitude ,-41.3499,</p>,<br>,<h3>,*** Trekourse Review ***,</h3>,<p>,Learn about forest plant life from information signs on this easy walk.
<p>,1. Course name : ,Yeoman s Track,</p>,<p>,2. Distance : ,3.97 kilometer,</p>,<p>,3. Duration : ,3 hr 30 min - 4 hr 30 min,</p>,<p>,4. Overnight : ,0, nights,</p>,<p>,5. Difficulty : ,Easy,</p>,<p>,6. Course style : ,one_way,</p>,<p>,7. Coordinates : longitude ,176.2645, and latitude ,-39.7204,</p>,<br>,<h3>,*** Trekourse Review ***,</h3>,<p>,This forest track follows an old route where logs were once hauled to Yeoman’s Mill. It is open to walkers and mountain bikers.
<p>,1. Course name : ,A Frame Hut & Takapari Road Track,</p>,<p>,2. Distance : ,2.46 kilometer,</p>,<p>,3. Duration : ,2 - 3 hr,</p>,<p>,4. Overnight : ,0, nights,</p>,<p>,5. Difficulty : ,Advanced,</p>,<p>,6. Course style : ,one_way,</p>,<p>,7. Coordinates : longitude ,176.0208, and latitude ,-40.1135,</p>,<br>,<h3>,*** Trekourse Review ***,</h3>,<p>,Head to Tamaki Road end by following the track up through forest to Takapari Road. From there you’ll follow a bulldozed road 100 m to the hut. 
<p>,1. Course name : ,Peak Hill Route,</p>,<p>,2. Distance : ,3.04 kilometer,</p>,<p>,3. Duration : ,3 hr return,</p>,<p>,4. Overnight : ,0, nights,</p>,<p>,5. Difficulty : ,Expert,</p>,<p>,6. Course style : ,return,</p>,<p>,7. Coordinates : longitude ,171.4916, and latitude ,-43.3177,</p>,<br>,<h3>,*** Trekourse Review ***,</h3>,<p>,The climb to the top of Peak Hill rewards walkers with sweeping views of Lake Coleridge and its surrounds. The walk is extremely exposed to the weather and walkers should be well equipped.
<p>,1. Course name : ,Willberg Walk,</p>,<p>,2. Distance : ,751.37 meter,</p>,<p>,3. Duration : ,30 min,</p>,<p>,4. Overnight : ,0, nights,</p>,<p>,5. Difficulty : ,Easiest,</p>,<p>,6. Course style : ,one_way,</p>,<p>,7. Coordinates : longitude ,170.5632, and latitude ,-43.1524,</p>,<br>,<h3>,*** Trekourse Review ***,</h3>,<p>,The Willberg Walk in Harihari climbs gently through rimu forest.
<p>,1. Course name : ,Tangoio Falls Scenic Reserve tracks,</p>,<p>,2. Distance : ,3.64 kilometer,</p>,<p>,3. Duration : ,Various: 30 min - 2 hr,</p>,<p>,4. Overnight : ,0, nights,</p>,<p>,5. Difficulty : ,"Easiest,Easy",</p>,<p>,6. Course style : ,one_way,</p>,<p>,7. Coordinates : longitude ,176.8771, and latitude ,-39.3016,</p>,<br>,<h3>,*** Trekourse Review ***,</h3>,<p>,"Discover Te Ana or Tangoio Falls on a short, easy walk suitable for kids, or take a longer walk through native bush on the Tangoio Walkway."
<p>,1. Course name : ,Kuripapango tramping tracks,</p>,<p>,2. Distance : ,24.57 kilometer,</p>,<p>,3. Duration : ,9.5 hr,</p>,<p>,4. Overnight : ,0, nights,</p>,<p>,5. Difficulty : ,Advanced,</p>,<p>,6. Course style : ,one_way,</p>,<p>,7. Coordinates : longitude ,176.3921, and latitude ,-39.3407,</p>,<br>,<h3>,*** Trekourse Review ***,</h3>,<p>,There are a variety of options for day or overnight trips from Kuripapango/Castle Rocks Road. Some are round trips and some link with other road ends or access points to Kaweka Forest Park.
<p>,1. Course name : ,Sentinel Rock Lookout Track,</p>,<p>,2. Distance : ,2.53 kilometer,</p>,<p>,3. Duration : ,5 hr,</p>,<p>,4. Overnight : ,0, nights,</p>,<p>,5. Difficulty : ,Advanced,</p>,<p>,6. Course style : ,one_way,</p>,<p>,7. Coordinates : longitude ,175.8543, and latitude ,-37.6134,</p>,<br>,<h3>,*** Trekourse Review ***,</h3>,<p>,A challenging climb to an isolated rock outcrop in the Kaimai Ranges that offers spectacular views across the valley.
<p>,1. Course name : ,Terrace Walk ,</p>,<p>,2. Distance : ,779.3 meter,</p>,<p>,3. Duration : ,30 min,</p>,<p>,4. Overnight : ,0, nights,</p>,<p>,5. Difficulty : ,Easiest,</p>,<p>,6. Course style : ,one_way,</p>,<p>,7. Coordinates : longitude ,170.1845, and latitude ,-43.393,</p>,<br>,<h3>,*** Trekourse Review ***,</h3>,<p>,The walk provides a good introduction to the rainforest of the Glacier Region as well and an opportunity to see glow worms after dark - it's a great option with children.
<p>,1. Course name : ,Renfrew Roadend to Table Flat Roadend,</p>,<p>,2. Distance : ,19.74 kilometer,</p>,<p>,3. Duration : ,3 days,</p>,<p>,4. Overnight : ,3, nights,</p>,<p>,5. Difficulty : ,Advanced,</p>,<p>,6. Course style : ,one_way,</p>,<p>,7. Coordinates : longitude ,176.0573, and latitude ,-39.927,</p>,<br>,<h3>,*** Trekourse Review ***,</h3>,<p>,Climb up and over the tussock tops of the Whanahuia Range in Ruahine Forest Park then drop down to follow the Oroua River valley.
<p>,1. Course name : ,Orokawa Scenic Reserve short walking tracks,</p>,<p>,2. Distance : ,9.25 kilometer,</p>,<p>,3. Duration : ,Various times under 4 hr,</p>,<p>,4. Overnight : ,0, nights,</p>,<p>,5. Difficulty : ,Easy,</p>,<p>,6. Course style : ,one_way,</p>,<p>,7. Coordinates : longitude ,175.9323, and latitude ,-37.3802,</p>,<br>,<h3>,*** Trekourse Review ***,</h3>,<p>,There are a number short walks you can enjoy in the Orokawa Scenic Reserve.
<p>,1. Course name : ,Papa Aroha Walk,</p>,<p>,2. Distance : ,484.79 meter,</p>,<p>,3. Duration : ,40 min return,</p>,<p>,4. Overnight : ,0, nights,</p>,<p>,5. Difficulty : ,Easiest,</p>,<p>,6. Course style : ,return,</p>,<p>,7. Coordinates : longitude ,175.4311, and latitude ,-36.6992,</p>,<br>,<h3>,*** Trekourse Review ***,</h3>,<p>,Walk through coastal forest to an attractive beach.
<p>,1. Course name : ,Jacks Blowhole Track,</p>,<p>,2. Distance : ,1.48 kilometer,</p>,<p>,3. Duration : ,1 hr,</p>,<p>,4. Overnight : ,0, nights,</p>,<p>,5. Difficulty : ,Easy,</p>,<p>,6. Course style : ,one_way,</p>,<p>,7. Coordinates : longitude ,169.7044, and latitude ,-46.5038,</p>,<br>,<h3>,*** Trekourse Review ***,</h3>,<p>,Walk to a spectacular blowhole with exploding waves and roaring sound effects.
<p>,1. Course name : ,Greenstone and Caples tracks,</p>,<p>,2. Distance : ,64.48 kilometer,</p>,<p>,3. Duration : ,4 days,</p>,<p>,4. Overnight : ,3, nights,</p>,<p>,5. Difficulty : ,Intermediate,</p>,<p>,6. Course style : ,one_way,</p>,<p>,7. Coordinates : longitude ,168.2587, and latitude ,-44.8806,</p>,<br>,<h3>,*** Trekourse Review ***,</h3>,<p>,"The Caples and Greenstone tracks start from the car park at the end of Greenstone Road, 86 km from Queenstown, via Glenorchy. Alternatively, they can be started from Howden Hut on the Routeburn Track."
<p>,1. Course name : ,Rough Creek Track,</p>,<p>,2. Distance : ,4.14 kilometer,</p>,<p>,3. Duration : ,5 hr 30 min - 6 hr,</p>,<p>,4. Overnight : ,0, nights,</p>,<p>,5. Difficulty : ,Advanced,</p>,<p>,6. Course style : ,one_way,</p>,<p>,7. Coordinates : longitude ,172.2749, and latitude ,-42.3966,</p>,<br>,<h3>,*** Trekourse Review ***,</h3>,<p>,This track leads to Lake Christabel.
<p>,1. Course name : ,Whakapapaiti Valley Track,</p>,<p>,2. Distance : ,10.42 kilometer,</p>,<p>,3. Duration : ,4 - 5 hr,</p>,<p>,4. Overnight : ,0, nights,</p>,<p>,5. Difficulty : ,Advanced,</p>,<p>,6. Course style : ,one_way,</p>,<p>,7. Coordinates : longitude ,175.5139, and latitude ,-39.2151,</p>,<br>,<h3>,*** Trekourse Review ***,</h3>,<p>,"Winding through stunted beech forest, the Whakapapaiti Valley Track makes its way to the Whakapapaiti Hut. From here you can continue in a loop back to Whakapapa Village."
<p>,1. Course name : ,Hollyford Track,</p>,<p>,2. Distance : ,8.61 kilometer,</p>,<p>,3. Duration : ,4 - 6 hr,</p>,<p>,4. Overnight : ,0, nights,</p>,<p>,5. Difficulty : ,Advanced,</p>,<p>,6. Course style : ,one_way,</p>,<p>,7. Coordinates : longitude ,168.1259, and latitude ,-44.6613,</p>,<br>,<h3>,*** Trekourse Review ***,</h3>,<p>,Enjoy this easy day walk along the Hollyford Track to the beautiful Hidden Falls or the nearby hut for lunch.
<p>,1. Course name : ,Hideaway Hut Route,</p>,<p>,2. Distance : ,2.04 kilometer,</p>,<p>,3. Duration : ,2 hr one way,</p>,<p>,4. Overnight : ,0, nights,</p>,<p>,5. Difficulty : ,Expert,</p>,<p>,6. Course style : ,one_way,</p>,<p>,7. Coordinates : longitude ,169.6834, and latitude ,-44.413,</p>,<br>,<h3>,*** Trekourse Review ***,</h3>,<p>,This little gem of a hut is tucked away in Ahuriri Conservation Park. 
<p>,1. Course name : ,Te Henga Walkway,</p>,<p>,2. Distance : ,9.56 kilometer,</p>,<p>,3. Duration : ,2.5 hr one way,</p>,<p>,4. Overnight : ,0, nights,</p>,<p>,5. Difficulty : ,"Easy,Intermediate",</p>,<p>,6. Course style : ,one_way,</p>,<p>,7. Coordinates : longitude ,174.4366, and latitude ,-36.8673,</p>,<br>,<h3>,*** Trekourse Review ***,</h3>,<p>,The cliff top walk from Bethells Beach (Te Henga) to south of Muriwai Beach (or reverse) reveals stunning views of Auckland's wild west coast. 
<p>,1. Course name : ,Lake Mistletoe Track,</p>,<p>,2. Distance : ,512.83 meter,</p>,<p>,3. Duration : ,45 min,</p>,<p>,4. Overnight : ,0, nights,</p>,<p>,5. Difficulty : ,Easy,</p>,<p>,6. Course style : ,one_way,</p>,<p>,7. Coordinates : longitude ,167.8237, and latitude ,-45.201,</p>,<br>,<h3>,*** Trekourse Review ***,</h3>,<p>,"This easy, short walking track is suitable for all ages, wandering from the Milford Road through forest to peaceful Lake Mistletoe."
<p>,1. Course name : ,Fowlers Pass Track,</p>,<p>,2. Distance : ,15.37 kilometer,</p>,<p>,3. Duration : ,5 hr 30 min,</p>,<p>,4. Overnight : ,0, nights,</p>,<p>,5. Difficulty : ,Advanced,</p>,<p>,6. Course style : ,one_way,</p>,<p>,7. Coordinates : longitude ,172.7098, and latitude ,-42.2989,</p>,<br>,<h3>,*** Trekourse Review ***,</h3>,<p>,Fowlers Pass (1296 m) connects Fowlers Hut on Tophouse Road with Stanley Vale and Lake Guyon huts in the St James Conservation Area.
<p>,1. Course name : ,Mangapohue Natural Bridge Walk,</p>,<p>,2. Distance : ,859.18 meter,</p>,<p>,3. Duration : ,20 min,</p>,<p>,4. Overnight : ,0, nights,</p>,<p>,5. Difficulty : ,Easiest,</p>,<p>,6. Course style : ,one_way,</p>,<p>,7. Coordinates : longitude ,174.9007, and latitude ,-38.2603,</p>,<br>,<h3>,*** Trekourse Review ***,</h3>,<p>,Walk through an impressive limestone gorge that passes underneath a 17 m high natural arch.
