<p>,name,name_first,</p>,<p>,distance,distance,</p>,<p>,Duration : ,completionTime,</p>,<p>,Overnight : ,duration_nights, nights,</p>,<p>,Difficulty : ,difficulty,</p>,<p>,Course style : ,course_style,</p>,<p>,Coordinates,X,latitude,Y,</p>,<br>,<h3>,*** Trekourse Review ***,</h3>,<p>,introduction
<p>,1. Course name : ,Kaniwhaniwha,</p>,<p>,2. Distance : ,4.56 kilometer,</p>,<p>,3. Duration : ,2 hr 30 min return,</p>,<p>,4. Overnight : ,0, nights,</p>,<p>,5. Difficulty : ,Easy,</p>,<p>,6. Course style : ,return,</p>,<p>,7. Coordinates : longitude ,175.0801, and latitude ,-37.9325,</p>,<br>,<h3>,*** Trekourse Review ***,</h3>,<p>,"Follow a stream through beautiful native forest or walk through a 20 metre limestone cave - with swimming and picnicking opportunities as well, these tracks are great for children."
<p>,1. Course name : ,Abel Tasman Coast Track,</p>,<p>,2. Distance : ,64.7 kilometer,</p>,<p>,3. Duration : ,3 - 5 days,</p>,<p>,4. Overnight : ,3, nights,</p>,<p>,5. Difficulty : ,Intermediate,</p>,<p>,6. Course style : ,one_way,</p>,<p>,7. Coordinates : longitude ,173.0175, and latitude ,-40.8651,</p>,<br>,<h3>,*** Trekourse Review ***,</h3>,<p>,"Blessed with a mild climate, golden beaches and lush coastal native bush, the Abel Tasman Coast Track has it all."
<p>,1. Course name : ,Boundary Creek Track,</p>,<p>,2. Distance : ,2.31 kilometer,</p>,<p>,3. Duration : ,6- 8 hr,</p>,<p>,4. Overnight : ,0, nights,</p>,<p>,5. Difficulty : ,Advanced,</p>,<p>,6. Course style : ,one_way,</p>,<p>,7. Coordinates : longitude ,169.208, and latitude ,-44.341,</p>,<br>,<h3>,*** Trekourse Review ***,</h3>,<p>,A pleasant climb up an old musterers' track above an upland river gorge.
<p>,1. Course name : ,Stanley River Route,</p>,<p>,2. Distance : ,16.1 kilometer,</p>,<p>,3. Duration : ,6 hr,</p>,<p>,4. Overnight : ,0, nights,</p>,<p>,5. Difficulty : ,Expert,</p>,<p>,6. Course style : ,one_way,</p>,<p>,7. Coordinates : longitude ,172.6439, and latitude ,-42.3782,</p>,<br>,<h3>,*** Trekourse Review ***,</h3>,<p>,This marked route links Charlies Saddle to Stanley Vale Hut in the St James Conservation Area. 
<p>,1. Course name : ,Wainui Falls Track,</p>,<p>,2. Distance : ,1.71 kilometer,</p>,<p>,3. Duration : ,1 hr 20 min return,</p>,<p>,4. Overnight : ,0, nights,</p>,<p>,5. Difficulty : ,Easy,</p>,<p>,6. Course style : ,return,</p>,<p>,7. Coordinates : longitude ,172.9402, and latitude ,-40.8388,</p>,<br>,<h3>,*** Trekourse Review ***,</h3>,<p>,"A short walk through lush native bush leads to the cascading Wainui Falls, the largest and most accessible falls in Golden Bay/Mohua - there's a long swing bridge for children to enjoy as well. It's one of our best short walks."
<p>,1. Course name : ,Te Haua Uru Track,</p>,<p>,2. Distance : ,3.31 kilometer,</p>,<p>,3. Duration : ,3 hr 45 min to junction one way from car park,</p>,<p>,4. Overnight : ,0, nights,</p>,<p>,5. Difficulty : ,Advanced,</p>,<p>,6. Course style : ,one_way,</p>,<p>,7. Coordinates : longitude ,174.1243, and latitude ,-35.8805,</p>,<br>,<h3>,*** Trekourse Review ***,</h3>,<p>,The Te Haua Uru Track is located in the Tangihua Forest and links with the Horokaka Track and Tangihua Main Ridge Track to form a loop that will take experienced trampers 9 hours to complete.  
<p>,1. Course name : ,Otukaikino Walk,</p>,<p>,2. Distance : ,1.03 kilometer,</p>,<p>,3. Duration : ,45 min,</p>,<p>,4. Overnight : ,0, nights,</p>,<p>,5. Difficulty : ,Easiest,</p>,<p>,6. Course style : ,one_way,</p>,<p>,7. Coordinates : longitude ,172.6441, and latitude ,-43.4332,</p>,<br>,<h3>,*** Trekourse Review ***,</h3>,<p>,"This short, easy track loops around a wetland - with interpretation panels as well it's a great option for kids."
<p>,1. Course name : ,Knuckle Hill Track,</p>,<p>,2. Distance : ,4.56 kilometer,</p>,<p>,3. Duration : ,1 hr 20 min,</p>,<p>,4. Overnight : ,0, nights,</p>,<p>,5. Difficulty : ,Advanced,</p>,<p>,6. Course style : ,one_way,</p>,<p>,7. Coordinates : longitude ,172.5519, and latitude ,-40.6341,</p>,<br>,<h3>,*** Trekourse Review ***,</h3>,<p>,"From the top of Knuckle Hill are excellent views of the top of the South Island, particularly Farewell Spit and Whanganui Inlet."
<p>,1. Course name : ,Tarawera Outlet to Falls Track,</p>,<p>,2. Distance : ,5.07 kilometer,</p>,<p>,3. Duration : ,2 hr,</p>,<p>,4. Overnight : ,0, nights,</p>,<p>,5. Difficulty : ,Easy,</p>,<p>,6. Course style : ,one_way,</p>,<p>,7. Coordinates : longitude ,176.5123, and latitude ,-38.1741,</p>,<br>,<h3>,*** Trekourse Review ***,</h3>,<p>,See the Tarawera River disappearing underground at various sites before it re-emerges through the spectacular Tarawera Falls through narrow fissures in a fractured rhyolite lava cliff.
<p>,1. Course name : ,Goat Island Walkway ,</p>,<p>,2. Distance : ,1.41 kilometer,</p>,<p>,3. Duration : ,45 min to 1 hr one way,</p>,<p>,4. Overnight : ,0, nights,</p>,<p>,5. Difficulty : ,Easy,</p>,<p>,6. Course style : ,one_way,</p>,<p>,7. Coordinates : longitude ,174.8031, and latitude ,-36.2709,</p>,<br>,<h3>,*** Trekourse Review ***,</h3>,<p>,This return walk traverses the coast part way to Cape Rodney. overlooking New Zealand's oldest and most popular marine reserve.  
<p>,1. Course name : ,Maitai Bay Headland Track,</p>,<p>,2. Distance : ,1.66 kilometer,</p>,<p>,3. Duration : ,1.5 hr,</p>,<p>,4. Overnight : ,0, nights,</p>,<p>,5. Difficulty : ,Advanced,</p>,<p>,6. Course style : ,one_way,</p>,<p>,7. Coordinates : longitude ,173.413, and latitude ,-34.8217,</p>,<br>,<h3>,*** Trekourse Review ***,</h3>,<p>,"Pass through farmland and manuka scrubland to Maitai Bay Headlands, where you can enjoy scenic views of Waikato Bay and Maitai Bay."
<p>,1. Course name : ,Motukiore Island Walk,</p>,<p>,2. Distance : ,2.56 kilometer,</p>,<p>,3. Duration : ,1 hr 30 min,</p>,<p>,4. Overnight : ,0, nights,</p>,<p>,5. Difficulty : ,Easy,</p>,<p>,6. Course style : ,one_way,</p>,<p>,7. Coordinates : longitude ,174.4377, and latitude ,-35.7872,</p>,<br>,<h3>,*** Trekourse Review ***,</h3>,<p>,"This pleasant and easy walk takes you around the coastline across a causeway to Motukiore Island, and is a great summer family outing."
<p>,1. Course name : ,Whakaipo Bay tracks,</p>,<p>,2. Distance : ,22.12 kilometer,</p>,<p>,3. Duration : ,4 hr 30 min | 8 hr,</p>,<p>,4. Overnight : ,0, nights,</p>,<p>,5. Difficulty : ,Easy,</p>,<p>,6. Course style : ,one_way,</p>,<p>,7. Coordinates : longitude ,175.9334, and latitude ,-38.6859,</p>,<br>,<h3>,*** Trekourse Review ***,</h3>,<p>,Walk or ride over the headland between Whakaipo and Whangamata bays and enjoy the lake views and native bush.
<p>,1. Course name : ,Goldie Bush Walkway ,</p>,<p>,2. Distance : ,3.59 kilometer,</p>,<p>,3. Duration : ,2 hr,</p>,<p>,4. Overnight : ,0, nights,</p>,<p>,5. Difficulty : ,"Easy,Advanced",</p>,<p>,6. Course style : ,one_way,</p>,<p>,7. Coordinates : longitude ,174.4558, and latitude ,-36.8475,</p>,<br>,<h3>,*** Trekourse Review ***,</h3>,<p>,"Goldie Bush Scenic Reserve offers a variety of walks through coastal kauri forest, taking in the impressive Mokoroa Falls."
<p>,1. Course name : ,Otamahua Quail Island tracks,</p>,<p>,2. Distance : ,5.61 kilometer,</p>,<p>,3. Duration : ,2 hr 30 min for complete island circuit,</p>,<p>,4. Overnight : ,0, nights,</p>,<p>,5. Difficulty : ,"Easiest,Easy",</p>,<p>,6. Course style : ,one_way,</p>,<p>,7. Coordinates : longitude ,172.6927, and latitude ,-43.6279,</p>,<br>,<h3>,*** Trekourse Review ***,</h3>,<p>,"Explore historic sites such as the ships' graveyard and the quarantine barracks, as well as swimming and waterskiing beaches and a bird-watching barricade.
The easy grade makes these walks suitable for small children and family groups."
<p>,1. Course name : ,Twilight   Te Werahi Loop Track,</p>,<p>,2. Distance : ,21.31 kilometer,</p>,<p>,3. Duration : ,4 hr 30 min - 5 hr,</p>,<p>,4. Overnight : ,0, nights,</p>,<p>,5. Difficulty : ,Advanced,</p>,<p>,6. Course style : ,one_way,</p>,<p>,7. Coordinates : longitude ,172.6878, and latitude ,-34.4899,</p>,<br>,<h3>,*** Trekourse Review ***,</h3>,<p>,The round-trip walk is 16 km in length and takes between 4 hours 30 minutes to 5 hours to complete. The track crosses farmlands and dunes. 
<p>,1. Course name : ,Manuka Bay Track (Port Robinson Walkway),</p>,<p>,2. Distance : ,3.57 kilometer,</p>,<p>,3. Duration : ,1 hr 45 min,</p>,<p>,4. Overnight : ,0, nights,</p>,<p>,5. Difficulty : ,Intermediate,</p>,<p>,6. Course style : ,one_way,</p>,<p>,7. Coordinates : longitude ,173.2984, and latitude ,-42.8978,</p>,<br>,<h3>,*** Trekourse Review ***,</h3>,<p>,"The Manuka Bay track links Port Robinson with the mouth of the Hurunui River. Passing through a variety of coastal scenery, this easy tramping grade track is ideal for family groups."
<p>,1. Course name : ,Mount Robert Circuit,</p>,<p>,2. Distance : ,7.46 kilometer,</p>,<p>,3. Duration : ,5 hr return,</p>,<p>,4. Overnight : ,0, nights,</p>,<p>,5. Difficulty : ,Advanced,</p>,<p>,6. Course style : ,return,</p>,<p>,7. Coordinates : longitude ,172.8213, and latitude ,-41.8272,</p>,<br>,<h3>,*** Trekourse Review ***,</h3>,<p>,This loop track around the northern face of Pourangahau/Mount Robert offers spectacular views over Lake Rotoiti that will keep even kids entertained. It can be enjoyed as a day or overnight walk.
<p>,1. Course name : ,Devils Punchbowl Walking Track,</p>,<p>,2. Distance : ,663.45 meter,</p>,<p>,3. Duration : ,1 hr return,</p>,<p>,4. Overnight : ,0, nights,</p>,<p>,5. Difficulty : ,Easy,</p>,<p>,6. Course style : ,return,</p>,<p>,7. Coordinates : longitude ,171.561, and latitude ,-42.9352,</p>,<br>,<h3>,*** Trekourse Review ***,</h3>,<p>,Feel the full force and sound of fresh mountain water falling 131 m down one of New Zealand’s most stunning waterfalls. It's one of our best short walks.
<p>,1. Course name : ,Harper Pass Route,</p>,<p>,2. Distance : ,70.95 kilometer,</p>,<p>,3. Duration : ,4-5 days,</p>,<p>,4. Overnight : ,4, nights,</p>,<p>,5. Difficulty : ,Advanced,</p>,<p>,6. Course style : ,one_way,</p>,<p>,7. Coordinates : longitude ,171.9993, and latitude ,-42.7005,</p>,<br>,<h3>,*** Trekourse Review ***,</h3>,<p>,Harper Pass was the main pathway to and from the west coast for Māori when trading for pounamu (greenstone). Follow this historic route from west to east.
<p>,1. Course name : ,North South Track,</p>,<p>,2. Distance : ,74.54 kilometer,</p>,<p>,3. Duration : ,5 - 7 days,</p>,<p>,4. Overnight : ,6, nights,</p>,<p>,5. Difficulty : ,Expert,</p>,<p>,6. Course style : ,one_way,</p>,<p>,7. Coordinates : longitude ,175.8448, and latitude ,-37.6486,</p>,<br>,<h3>,*** Trekourse Review ***,</h3>,<p>,"This is a multi-day tramp using rugged, unmarked routes suitable for expert backcountry trampers only. Trampers will need to camp in addition to staying in huts."
<p>,1. Course name : ,Speargrass Track,</p>,<p>,2. Distance : ,6.47 kilometer,</p>,<p>,3. Duration : ,2 hr 30 min one way,</p>,<p>,4. Overnight : ,0, nights,</p>,<p>,5. Difficulty : ,Intermediate,</p>,<p>,6. Course style : ,one_way,</p>,<p>,7. Coordinates : longitude ,172.7814, and latitude ,-41.8367,</p>,<br>,<h3>,*** Trekourse Review ***,</h3>,<p>,"For an easy overnight tramp, great for kids, walk to Speargrass Hut on this well graded track."
<p>,1. Course name : ,Moerangi Track,</p>,<p>,2. Distance : ,30.5 kilometer,</p>,<p>,3. Duration : ,2-3 days,</p>,<p>,4. Overnight : ,2, nights,</p>,<p>,5. Difficulty : ,Advanced,</p>,<p>,6. Course style : ,one_way,</p>,<p>,7. Coordinates : longitude ,176.7259, and latitude ,-38.715,</p>,<br>,<h3>,*** Trekourse Review ***,</h3>,<p>,"The Moerangi Track is a 35 km dual purpose track, which attracts both mountain bikers and trampers to experience a multi-day adventure deep in the wonderful 'Jurassic' Whirinaki Te Pua-a-Tāne Conservation Park."
<p>,1. Course name : ,Piripiri Cave Walk,</p>,<p>,2. Distance : ,151.52 meter,</p>,<p>,3. Duration : ,5 min,</p>,<p>,4. Overnight : ,0, nights,</p>,<p>,5. Difficulty : ,Easiest,</p>,<p>,6. Course style : ,one_way,</p>,<p>,7. Coordinates : longitude ,174.8627, and latitude ,-38.2554,</p>,<br>,<h3>,*** Trekourse Review ***,</h3>,<p>,Walk to a cave entrance with a viewing platform.
<p>,1. Course name : ,Whangamumu Track,</p>,<p>,2. Distance : ,3.36 kilometer,</p>,<p>,3. Duration : ,1 hr,</p>,<p>,4. Overnight : ,0, nights,</p>,<p>,5. Difficulty : ,Easy,</p>,<p>,6. Course style : ,one_way,</p>,<p>,7. Coordinates : longitude ,174.2817, and latitude ,-35.2537,</p>,<br>,<h3>,*** Trekourse Review ***,</h3>,<p>,Go for an easy forest and beach walk to Whangamumu Harbour and Te Toroa Bay. Learn about the history while challenging the kids. 
<p>,1. Course name : ,Five Mile Loop Track,</p>,<p>,2. Distance : ,1.97 kilometer,</p>,<p>,3. Duration : ,1 hr 30 min,</p>,<p>,4. Overnight : ,0, nights,</p>,<p>,5. Difficulty : ,Easy,</p>,<p>,6. Course style : ,one_way,</p>,<p>,7. Coordinates : longitude ,174.9366, and latitude ,-41.3432,</p>,<br>,<h3>,*** Trekourse Review ***,</h3>,<p>,This easy track passes through superb groves of mature hard beech in the lower reaches of Graces Stream.
<p>,1. Course name : ,Ruakuri Walk,</p>,<p>,2. Distance : ,1.04 kilometer,</p>,<p>,3. Duration : ,45 min,</p>,<p>,4. Overnight : ,0, nights,</p>,<p>,5. Difficulty : ,Easiest,</p>,<p>,6. Course style : ,one_way,</p>,<p>,7. Coordinates : longitude ,175.0775, and latitude ,-38.2658,</p>,<br>,<h3>,*** Trekourse Review ***,</h3>,<p>,"Discover a forested gorge, natural sculpted cliffs and low limestone arches on this spectacular loop walk - plenty to keep kids interested."
<p>,1. Course name : ,Cathedral Cove Walk,</p>,<p>,2. Distance : ,1.93 kilometer,</p>,<p>,3. Duration : ,1 hr 30 min return,</p>,<p>,4. Overnight : ,0, nights,</p>,<p>,5. Difficulty : ,Easy,</p>,<p>,6. Course style : ,return,</p>,<p>,7. Coordinates : longitude ,175.7991, and latitude ,-36.8334,</p>,<br>,<h3>,*** Trekourse Review ***,</h3>,<p>,Stunning views of the Coromandel coast guide you to the dramatic cliffs and iconic rock archway of Cathedral Cove. This is one of best short walks.
<p>,1. Course name : ,Cloustons Mine Track,</p>,<p>,2. Distance : ,4.63 kilometer,</p>,<p>,3. Duration : ,3 hr one way,</p>,<p>,4. Overnight : ,0, nights,</p>,<p>,5. Difficulty : ,Advanced,</p>,<p>,6. Course style : ,one_way,</p>,<p>,7. Coordinates : longitude ,172.6954, and latitude ,-41.1822,</p>,<br>,<h3>,*** Trekourse Review ***,</h3>,<p>,Walk this track as part of a day walk circuit from Flora car park.
<p>,1. Course name : ,Ruapane Lookout,</p>,<p>,2. Distance : ,5.03 kilometer,</p>,<p>,3. Duration : ,1 hr | 1 hr 30 min one way,</p>,<p>,4. Overnight : ,0, nights,</p>,<p>,5. Difficulty : ,"Easy,Advanced",</p>,<p>,6. Course style : ,one_way,</p>,<p>,7. Coordinates : longitude ,175.13, and latitude ,-37.9687,</p>,<br>,<h3>,*** Trekourse Review ***,</h3>,<p>,Climb to a lookout on Mount Pirongia with excellent views across the Waikato Basin to the Kaimai Ranges.
<p>,1. Course name : ,Little Mt Peel Huatekerekere tracks,</p>,<p>,2. Distance : ,8.34 kilometer,</p>,<p>,3. Duration : ,4–7 hr return,</p>,<p>,4. Overnight : ,0, nights,</p>,<p>,5. Difficulty : ,Advanced,</p>,<p>,6. Course style : ,return,</p>,<p>,7. Coordinates : longitude ,171.2277, and latitude ,-43.8962,</p>,<br>,<h3>,*** Trekourse Review ***,</h3>,<p>,"Climb one of the most popular peaks in Canterbury for magnificent views to Mt Somers, Mt Hutt and across the plains to the coast."
<p>,1. Course name : ,Monckton Walkway,</p>,<p>,2. Distance : ,432.16 meter,</p>,<p>,3. Duration : ,1 hr 30 min - 2 hr,</p>,<p>,4. Overnight : ,0, nights,</p>,<p>,5. Difficulty : ,Easiest,</p>,<p>,6. Course style : ,one_way,</p>,<p>,7. Coordinates : longitude ,176.2833, and latitude ,-39.965,</p>,<br>,<h3>,*** Trekourse Review ***,</h3>,<p>,"Enjoy a short walk through native forest rich in kahikatea, totara, beech, matai, tawa and kowhai. Plenty of native birds to see as well."
<p>,1. Course name : ,Purity to Kawhatau Base Track,</p>,<p>,2. Distance : ,9.09 kilometer,</p>,<p>,3. Duration : ,3-4 days,</p>,<p>,4. Overnight : ,3, nights,</p>,<p>,5. Difficulty : ,Advanced,</p>,<p>,6. Course style : ,one_way,</p>,<p>,7. Coordinates : longitude ,176.0389, and latitude ,-39.8395,</p>,<br>,<h3>,*** Trekourse Review ***,</h3>,<p>,Walk along the tussock tops of the Hikurangi Range between Purity and McKinnon huts in the Ruahine Forest Park.
<p>,1. Course name : ,Cathedral Caves Walk,</p>,<p>,2. Distance : ,169.02 meter,</p>,<p>,3. Duration : ,30 min one way,</p>,<p>,4. Overnight : ,0, nights,</p>,<p>,5. Difficulty : ,Easy,</p>,<p>,6. Course style : ,one_way,</p>,<p>,7. Coordinates : longitude ,169.375, and latitude ,-46.6073,</p>,<br>,<h3>,*** Trekourse Review ***,</h3>,<p>,Walk through bush and along the beach to explore the impressive Cathedral Caves.
<p>,1. Course name : ,Orokonui lagoon walk,</p>,<p>,2. Distance : ,1.12 kilometer,</p>,<p>,3. Duration : ,1 hr,</p>,<p>,4. Overnight : ,0, nights,</p>,<p>,5. Difficulty : ,Easy,</p>,<p>,6. Course style : ,one_way,</p>,<p>,7. Coordinates : longitude ,170.5888, and latitude ,-45.7577,</p>,<br>,<h3>,*** Trekourse Review ***,</h3>,<p>,Walk around the Orokonui lagoon through native bush and view the natural wetland providing habitat for native fish and foraging birds.
<p>,1. Course name : ,Donnelly Flat Loop Walk,</p>,<p>,2. Distance : ,2.58 kilometer,</p>,<p>,3. Duration : ,1 hr,</p>,<p>,4. Overnight : ,0, nights,</p>,<p>,5. Difficulty : ,Easy,</p>,<p>,6. Course style : ,one_way,</p>,<p>,7. Coordinates : longitude ,175.4711, and latitude ,-40.9042,</p>,<br>,<h3>,*** Trekourse Review ***,</h3>,<p>,"The track to Donnelly Flat passes through some of the best mixed podocarp/broadleaf forest in the Tararua Range - this short, easy walk with a picnic area and stream on route is an great option for kids."
<p>,1. Course name : ,Trotters Gorge tracks,</p>,<p>,2. Distance : ,3.36 kilometer,</p>,<p>,3. Duration : ,30 min one way |2 hr return,</p>,<p>,4. Overnight : ,0, nights,</p>,<p>,5. Difficulty : ,"Easy,Advanced",</p>,<p>,6. Course style : ,both,</p>,<p>,7. Coordinates : longitude ,170.7773, and latitude ,-45.4005,</p>,<br>,<h3>,*** Trekourse Review ***,</h3>,<p>,"Discover river sculpted caves or great views out to sea, as well as see and hear many of New Zealand's bush birds, on these tracks from Trotters Gorge Campsite."
<p>,1. Course name : ,Tarn Hut tracks,</p>,<p>,2. Distance : ,22.63 kilometer,</p>,<p>,3. Duration : ,2 days,</p>,<p>,4. Overnight : ,2, nights,</p>,<p>,5. Difficulty : ,Advanced,</p>,<p>,6. Course style : ,one_way,</p>,<p>,7. Coordinates : longitude ,172.1726, and latitude ,-43.0752,</p>,<br>,<h3>,*** Trekourse Review ***,</h3>,<p>,These tracks can be combined to form a circuit walk to Tarn Hut. 
<p>,1. Course name : ,Hihikiwi Lookout,</p>,<p>,2. Distance : ,5.08 kilometer,</p>,<p>,3. Duration : ,3 - 4 hr one way,</p>,<p>,4. Overnight : ,0, nights,</p>,<p>,5. Difficulty : ,Advanced,</p>,<p>,6. Course style : ,one_way,</p>,<p>,7. Coordinates : longitude ,175.0787, and latitude ,-38.0099,</p>,<br>,<h3>,*** Trekourse Review ***,</h3>,<p>,Walk to this lookout point on Mount Pirongia for one of the best vantage points over the west coast harbours.
<p>,1. Course name : ,Square Kauri Tree ,</p>,<p>,2. Distance : ,89.9 meter,</p>,<p>,3. Duration : ,20 min,</p>,<p>,4. Overnight : ,0, nights,</p>,<p>,5. Difficulty : ,Easiest,</p>,<p>,6. Course style : ,one_way,</p>,<p>,7. Coordinates : longitude ,175.5712, and latitude ,-36.99,</p>,<br>,<h3>,*** Trekourse Review ***,</h3>,<p>,Climb a short track to marvel at an unusual square trunked kauri and enjoy the view across to Maumaupaki on the main Coromandel Range.
<p>,1. Course name : ,Taurewa Track,</p>,<p>,2. Distance : ,3.41 kilometer,</p>,<p>,3. Duration : ,2 - 3 hr,</p>,<p>,4. Overnight : ,0, nights,</p>,<p>,5. Difficulty : ,Easy,</p>,<p>,6. Course style : ,one_way,</p>,<p>,7. Coordinates : longitude ,175.5499, and latitude ,-39.0721,</p>,<br>,<h3>,*** Trekourse Review ***,</h3>,<p>,Follow old milling trails through the bush.
<p>,1. Course name : ,Pukeatua Track,</p>,<p>,2. Distance : ,14.54 kilometer,</p>,<p>,3. Duration : ,9 hr,</p>,<p>,4. Overnight : ,0, nights,</p>,<p>,5. Difficulty : ,Advanced,</p>,<p>,6. Course style : ,one_way,</p>,<p>,7. Coordinates : longitude ,175.1885, and latitude ,-40.8938,</p>,<br>,<h3>,*** Trekourse Review ***,</h3>,<p>,Pukeatua Track connects Otaki Forks to Waikanae.
<p>,1. Course name : ,Richmond Trail,</p>,<p>,2. Distance : ,15.9 kilometer,</p>,<p>,3. Duration : ,4 - 5 hr,</p>,<p>,4. Overnight : ,0, nights,</p>,<p>,5. Difficulty : ,Easy,</p>,<p>,6. Course style : ,one_way,</p>,<p>,7. Coordinates : longitude ,170.6221, and latitude ,-43.8726,</p>,<br>,<h3>,*** Trekourse Review ***,</h3>,<p>,Enjoy stunning views of Lake Tekapo while walking or riding this track. 
<p>,1. Course name : ,Te Kere Haka Track,</p>,<p>,2. Distance : ,2.45 kilometer,</p>,<p>,3. Duration : ,1 hr,</p>,<p>,4. Overnight : ,0, nights,</p>,<p>,5. Difficulty : ,Easy,</p>,<p>,6. Course style : ,one_way,</p>,<p>,7. Coordinates : longitude ,168.7208, and latitude ,-45.3196,</p>,<br>,<h3>,*** Trekourse Review ***,</h3>,<p>,The Te Kere Haka Track follows the shore of Lake Wakatipu.
<p>,1. Course name : ,Kapiti Island tracks and walks,</p>,<p>,2. Distance : ,9.91 kilometer,</p>,<p>,3. Duration : ,Various times under 3 hr,</p>,<p>,4. Overnight : ,0, nights,</p>,<p>,5. Difficulty : ,Easy,</p>,<p>,6. Course style : ,one_way,</p>,<p>,7. Coordinates : longitude ,174.9317, and latitude ,-40.8511,</p>,<br>,<h3>,*** Trekourse Review ***,</h3>,<p>,Enjoy listening to and spotting birds on walks in two areas of Kapiti Island.
<p>,1. Course name : ,Mingha Deception Route,</p>,<p>,2. Distance : ,23.7 kilometer,</p>,<p>,3. Duration : ,2 - 3 days,</p>,<p>,4. Overnight : ,2, nights,</p>,<p>,5. Difficulty : ,Expert,</p>,<p>,6. Course style : ,one_way,</p>,<p>,7. Coordinates : longitude ,171.6166, and latitude ,-42.884,</p>,<br>,<h3>,*** Trekourse Review ***,</h3>,<p>,"This route is a classic traverse of the Southern Alps, crossing over Goat Pass. "
<p>,1. Course name : ,Kelly Knight Hut Track,</p>,<p>,2. Distance : ,2.79 kilometer,</p>,<p>,3. Duration : ,2 hr 30 min - 3 hr 30 min,</p>,<p>,4. Overnight : ,0, nights,</p>,<p>,5. Difficulty : ,Advanced,</p>,<p>,6. Course style : ,one_way,</p>,<p>,7. Coordinates : longitude ,176.041, and latitude ,-39.841,</p>,<br>,<h3>,*** Trekourse Review ***,</h3>,<p>,"The track to Kelly Knight Hut crosses farmland to the Ruahine Forest Park boundary, then sidles above the Pourangaki River to reach the hut via a swingbridge. Stay a night and return the same way."
<p>,1. Course name : ,Matietie Walk,</p>,<p>,2. Distance : ,3.08 kilometer,</p>,<p>,3. Duration : ,55 min,</p>,<p>,4. Overnight : ,0, nights,</p>,<p>,5. Difficulty : ,Advanced,</p>,<p>,6. Course style : ,one_way,</p>,<p>,7. Coordinates : longitude ,174.9902, and latitude ,-36.7773,</p>,<br>,<h3>,*** Trekourse Review ***,</h3>,<p>,This coastal walk takes you through the Matietie Historic Reserve.
<p>,1. Course name : ,Te Tapui Loop Track,</p>,<p>,2. Distance : ,5.86 kilometer,</p>,<p>,3. Duration : ,3 - 4 hr,</p>,<p>,4. Overnight : ,0, nights,</p>,<p>,5. Difficulty : ,Advanced,</p>,<p>,6. Course style : ,one_way,</p>,<p>,7. Coordinates : longitude ,175.6215, and latitude ,-37.814,</p>,<br>,<h3>,*** Trekourse Review ***,</h3>,<p>,"A loop track follows through the bush and up to the summit, with a lookout tower and great views across to the Kaimai Ranges and Firth of Thames."
<p>,1. Course name : ,Rangatira Point Track,</p>,<p>,2. Distance : ,2.63 kilometer,</p>,<p>,3. Duration : ,1 hr 30 min,</p>,<p>,4. Overnight : ,0, nights,</p>,<p>,5. Difficulty : ,Easy,</p>,<p>,6. Course style : ,one_way,</p>,<p>,7. Coordinates : longitude ,176.0149, and latitude ,-38.7362,</p>,<br>,<h3>,*** Trekourse Review ***,</h3>,<p>,"This easy walk winds through native bush along the lake edge, offering fantastic views and great picnic, swimming and fishing spots. It's perfect for families and those wanting to enjoy Lake Taupo."
<p>,1. Course name : ,Remutaka Rail Trail,</p>,<p>,2. Distance : ,5.35 kilometer,</p>,<p>,3. Duration : ,3 hr walk from Kaitoke,</p>,<p>,4. Overnight : ,0, nights,</p>,<p>,5. Difficulty : ,Easy,</p>,<p>,6. Course style : ,one_way,</p>,<p>,7. Coordinates : longitude ,175.2159, and latitude ,-41.1671,</p>,<br>,<h3>,*** Trekourse Review ***,</h3>,<p>,"Built in 1878, this rail route between the Hutt Valley and Featherston is now a gently graded 18 km walk, run or mountain bike ride, with opportunities for camping, swimming and fishing."
<p>,1. Course name : ,Southern Circuit Stewart Island Rakiura,</p>,<p>,2. Distance : ,85.79 kilometer,</p>,<p>,3. Duration : ,4 - 6 days round trip from Freshwater landing,</p>,<p>,4. Overnight : ,5, nights,</p>,<p>,5. Difficulty : ,Advanced,</p>,<p>,6. Course style : ,one_way,</p>,<p>,7. Coordinates : longitude ,167.8823, and latitude ,-46.9579,</p>,<br>,<h3>,*** Trekourse Review ***,</h3>,<p>,"Stewart Island/Rakiura's Southern Circuit Track is a remote, challenging tramp and requires good fitness, route-finding skills and backcountry experience."
<p>,1. Course name : ,Chalice Goulter Track,</p>,<p>,2. Distance : ,26.06 kilometer,</p>,<p>,3. Duration : ,2-3 days,</p>,<p>,4. Overnight : ,2, nights,</p>,<p>,5. Difficulty : ,Advanced,</p>,<p>,6. Course style : ,one_way,</p>,<p>,7. Coordinates : longitude ,173.2394, and latitude ,-41.5786,</p>,<br>,<h3>,*** Trekourse Review ***,</h3>,<p>,Follow the Goulter River from Lake Chalice.
